{
  "role": "DATA_GENERATION_ANALYST",
  "version": "1.0",
  "mode": "INITIAL",
  "content": {
    "hypotheses": [
      "弁当の販売数は、日付（曜日、月、日、週番号）、天候（気温、降水量）、イベントの有無、給料日、完売フラグといった要因に影響される。",
      "過去の販売データに基づいて、将来の販売数を予測できる。",
      "欠損値（kcal, precipitation）は、予測モデルの性能に悪影響を与える可能性がある。",
      "外れ値は、モデルの学習に歪みを生じさせ、予測精度を低下させる可能性がある。"
    ],
    "expected_patterns": [
      "特定の曜日（例: 週末や給料日前後）に販売数が多くなる傾向がある。",
      "天候が良い日（例: 気温が高く、降水量が少ない）は、販売数が増加する可能性がある。",
      "イベント開催日は、販売数が増加する可能性がある。",
      "完売フラグが立つ日は、需要が供給を上回っていることを示唆し、販売機会損失があったと推測できる。",
      "日付関連の特徴量（例: 月、日）により、季節的な販売パターンの変動が予測できる。"
    ],
    "risks": [
      "欠損値（kcal, precipitation）の処理が不十分な場合、モデルの精度が低下する。",
      "外れ値の処理が不適切だと、モデルの学習が不安定になる。",
      "特徴量エンジニアリングが不十分だと、モデルが販売数の変動要因を捉えきれない。",
      "モデル選択やハイパーパラメータチューニングが最適でない場合、目標RMSEスコア（7以内）を達成できない。",
      "提出用データのフォーマットが不正確だと、提出が無効になる可能性がある。"
    ]
  },
  "metadata": {
    "timestamp": "2024-04-02T12:00:00"
  }
}